{
  "$schema": "https://json-schema.org/draft/2020-12/schema",
  "$id": "https://arcnexus.local/schemas/component-v1",
  "type": "object",
  "properties": {
    "schemaVersion": {
      "enum": [
        1,
        2
      ]
    },
    "id": {
      "type": "string",
      "minLength": 1,
      "pattern": "^[a-zA-Z0-9_-]+$"
    },
    "type": {
      "enum": [
        "platform",
        "package",
        "foundation",
        "gateway",
        "library"
      ]
    },
    "repository": {
      "type": "string",
      "minLength": 1,
      "pattern": "^[a-zA-Z0-9_-]+$"
    },
    "purpose": {
      "type": "string",
      "minLength": 1
    },
    "path": {
      "type": "string",
      "minLength": 1
    },
    "objectives": {
      "type": "array",
      "items": {
        "type": "string",
        "minLength": 1
      },
      "uniqueItems": true
    },
    "constraints": {
      "type": "array",
      "items": {
        "type": "string",
        "minLength": 1
      },
      "uniqueItems": true
    },
    "questions": {
      "type": "array",
      "items": {
        "type": "string",
        "minLength": 1
      },
      "uniqueItems": true
    },
    "patterns": {
      "type": "array",
      "items": {
        "type": "string",
        "minLength": 1
      },
      "uniqueItems": true
    },
    "interfaces": {
      "type": "array",
      "items": {
        "type": "string",
        "minLength": 1
      },
      "uniqueItems": true
    },
    "documentation": {
      "type": "array",
      "items": {
        "type": "string",
        "minLength": 1
      },
      "uniqueItems": true
    },
    "tests": {
      "type": "array",
      "items": {
        "type": "string",
        "minLength": 1
      },
      "uniqueItems": true
    },
    "relatedIds": {
      "type": "array",
      "items": {
        "type": "string",
        "minLength": 1,
        "pattern": "^[a-zA-Z0-9_-]+$"
      },
      "uniqueItems": true
    },
    "role": {
      "type": "string",
      "minLength": 1,
      "pattern": "^[a-zA-Z0-9_-]+$"
    },
    "executionProfile": {
      "type": "string",
      "minLength": 1,
      "pattern": "^[a-zA-Z0-9_-]+$"
    },
    "access": {
      "type": "object",
      "properties": {
        "readPaths": {
          "type": "array",
          "items": {
            "type": "string",
            "minLength": 1
          },
          "uniqueItems": true
        },
        "writeDirectories": {
          "type": "array",
          "items": {
            "type": "string",
            "minLength": 1
          },
          "uniqueItems": true
        }
      },
      "required": [
        "readPaths",
        "writeDirectories"
      ],
      "additionalProperties": false
    },
    "allowedWritePaths": {
      "type": "array",
      "items": {
        "type": "string",
        "minLength": 1
      },
      "uniqueItems": true
    },
    "verification": {
      "type": "array",
      "items": {
        "type": "object",
        "properties": {
          "command": {
            "type": "string",
            "minLength": 1
          },
          "args": {
            "type": "array",
            "items": {
              "type": "string"
            }
          }
        },
        "required": [
          "command",
          "args"
        ],
        "additionalProperties": false
      }
    },
    "parentId": {
      "type": "string",
      "minLength": 1,
      "pattern": "^[a-zA-Z0-9_-]+$"
    },
    "members": {
      "type": "object",
      "properties": {
        "foundations": {
          "type": "array",
          "items": {
            "type": "string",
            "minLength": 1,
            "pattern": "^[a-zA-Z0-9_-]+$"
          },
          "uniqueItems": true
        },
        "dependencies": {
          "type": "array",
          "items": {
            "type": "string",
            "minLength": 1,
            "pattern": "^[a-zA-Z0-9_-]+$"
          },
          "uniqueItems": true
        },
        "gateways": {
          "type": "array",
          "items": {
            "type": "string",
            "minLength": 1,
            "pattern": "^[a-zA-Z0-9_-]+$"
          },
          "uniqueItems": true
        },
        "libraries": {
          "type": "array",
          "items": {
            "type": "string",
            "minLength": 1,
            "pattern": "^[a-zA-Z0-9_-]+$"
          },
          "uniqueItems": true
        },
        "releases": {
          "type": "array",
          "items": {
            "type": "string",
            "minLength": 1,
            "pattern": "^[a-zA-Z0-9_-]+$"
          },
          "uniqueItems": true
        }
      },
      "required": [
        "foundations",
        "dependencies",
        "gateways",
        "libraries",
        "releases"
      ],
      "additionalProperties": false
    },
    "operationIds": {
      "type": "array",
      "uniqueItems": true,
      "items": {
        "type": "string",
        "minLength": 1
      }
    }
  },
  "required": [
    "schemaVersion",
    "id",
    "type",
    "repository",
    "purpose",
    "path",
    "objectives",
    "constraints",
    "questions",
    "patterns",
    "interfaces",
    "documentation",
    "tests",
    "relatedIds",
    "role",
    "executionProfile",
    "access",
    "allowedWritePaths",
    "verification"
  ],
  "additionalProperties": false,
  "allOf": [
    {
      "if": {
        "properties": {
          "schemaVersion": {
            "const": 1
          }
        }
      },
      "then": {
        "properties": {
          "operationIds": false
        }
      }
    },
    {
      "if": {
        "properties": {
          "schemaVersion": {
            "const": 2
          }
        }
      },
      "then": {
        "required": [
          "operationIds"
        ],
        "properties": {
          "operationIds": {
            "type": "array",
            "uniqueItems": true,
            "items": {
              "type": "string",
              "minLength": 1
            }
          }
        }
      }
    }
  ]
}