{
  "id": "coordination-store",
  "type": "library",
  "purpose": "Persist atomic workday coordination and ordered evidence",
  "path": "src/workday-store.ts",
  "objectives": [
    "Persist atomic workday coordination and ordered evidence"
  ],
  "constraints": [
    "Preserve captured authority and evidence"
  ],
  "allowedWritePaths": [
    "src/workday-store.ts",
    "docs/coordination-store.md",
    "tests/runtime/workday-store.test.mjs"
  ],
  "verification": [
    {
      "command": "npm",
      "args": [
        "run",
        "check"
      ]
    },
    {
      "command": "npm",
      "args": [
        "test"
      ]
    },
    {
      "command": "node",
      "args": [
        "dist/cli.js",
        "guidance",
        "validate",
        "--project",
        "."
      ]
    }
  ],
  "questions": [],
  "patterns": [
    "Evidence-backed completion",
    "One host writer; candidate input never widens authority"
  ],
  "access": {
    "readPaths": [
      "."
    ],
    "writeDirectories": [
      "src",
      "schemas",
      "docs",
      "tests",
      "dist"
    ]
  },
  "schemaVersion": 2,
  "repository": "arcnexus",
  "role": "systems-engineer",
  "executionProfile": "luna",
  "interfaces": [
    "Atomic SQLite coordination transitions"
  ],
  "documentation": [
    "docs/coordination-store.md"
  ],
  "tests": [
    "tests/runtime/workday-store.test.mjs"
  ],
  "relatedIds": [
    "assignment",
    "workspace",
    "report"
  ],
  "parentId": "cli-package",
  "operationIds": []
}
