{
  "id": "report",
  "type": "library",
  "purpose": "Expose honest, readable evidence from a steward execution",
  "path": "src/report.ts",
  "objectives": [
    "Make actual execution outcomes easy to inspect"
  ],
  "constraints": [
    "Preserve JSON evidence and existing report fields",
    "Use the captured execution record without inspecting mutable target files",
    "Keep the supervising runner unchanged"
  ],
  "allowedWritePaths": [
    "src/report.ts",
    "tests/runtime/report.test.mjs",
    "docs/report.md",
    "src/timeline.ts"
  ],
  "verification": [
    {
      "command": "npm",
      "args": [
        "run",
        "check"
      ]
    },
    {
      "command": "npm",
      "args": [
        "test"
      ]
    },
    {
      "command": "node",
      "args": [
        "--test",
        "tests/runtime/report.test.mjs"
      ]
    },
    {
      "command": "node",
      "args": [
        "dist/cli.js",
        "guidance",
        "validate",
        "--project",
        "."
      ]
    }
  ],
  "questions": [],
  "patterns": [
    "Evidence-backed completion",
    "Small functions with coherent responsibilities"
  ],
  "access": {
    "readPaths": [
      "."
    ],
    "writeDirectories": [
      "src",
      "tests",
      "docs",
      "dist"
    ]
  },
  "schemaVersion": 2,
  "repository": "arcnexus",
  "role": "systems-engineer",
  "executionProfile": "luna",
  "interfaces": [
    "saveMarkdown: render captured execution record"
  ],
  "documentation": [
    "docs/report.md"
  ],
  "tests": [
    "tests/runtime/report.test.mjs"
  ],
  "relatedIds": [],
  "parentId": "cli-package",
  "operationIds": [
    "report-tests"
  ]
}
