{
  "schemaVersion": 2,
  "id": "identity",
  "type": "library",
  "repository": "sample",
  "role": "engineer",
  "executionProfile": "luna",
  "purpose": "Own identity contract",
  "path": "identity",
  "objectives": [
    "Verified bounded change"
  ],
  "constraints": [
    "No commits"
  ],
  "questions": [],
  "patterns": [],
  "interfaces": [],
  "documentation": [
    "identity/README.md"
  ],
  "tests": [
    "identity/test.mjs"
  ],
  "relatedIds": [],
  "allowedWritePaths": [
    "identity"
  ],
  "access": {
    "readPaths": [
      "."
    ],
    "writeDirectories": [
      "."
    ]
  },
  "verification": [
    {
      "command": "node",
      "args": [
        "--test",
        "identity/test.mjs"
      ]
    }
  ],
  "operationIds": []
}
