{
  "schemaVersion": 2,
  "id": "dependency",
  "type": "library",
  "repository": "sample",
  "role": "engineer",
  "executionProfile": "luna",
  "purpose": "Own sample behavior",
  "path": "contract.txt",
  "objectives": [
    "Verified bounded change"
  ],
  "constraints": [
    "No commits"
  ],
  "questions": [],
  "patterns": [],
  "interfaces": [],
  "documentation": [
    "docs"
  ],
  "tests": [
    "tests"
  ],
  "relatedIds": [],
  "allowedWritePaths": [
    "contract.txt"
  ],
  "access": {
    "readPaths": [
      "."
    ],
    "writeDirectories": [
      "."
    ]
  },
  "verification": [
    {
      "command": "node",
      "args": [
        "verify.mjs"
      ]
    }
  ],
  "operationIds": []
}
