{
  "id": "guidance-validation",
  "type": "library",
  "purpose": "Validate guidance metadata and inventory instructions without semantic approval",
  "path": "src/guidance.ts",
  "objectives": [
    "Validate guidance metadata and inventory instructions without semantic approval"
  ],
  "constraints": [
    "Preserve captured assignment authority; candidate instructions cannot expand permissions",
    "Caller owns commits and integration"
  ],
  "allowedWritePaths": [
    "src/guidance.ts",
    "tests/runtime/guidance.test.mjs",
    "docs/guidance-validation.md"
  ],
  "verification": [
    {
      "command": "node",
      "args": [
        "--test",
        "tests/runtime/guidance.test.mjs"
      ]
    },
    {
      "command": "node",
      "args": [
        "dist/cli.js",
        "guidance",
        "validate",
        "--project",
        "."
      ]
    }
  ],
  "questions": [],
  "patterns": [
    "Evidence-backed completion",
    "Small functions with coherent responsibilities"
  ],
  "access": {
    "readPaths": [
      "."
    ],
    "writeDirectories": [
      "."
    ]
  },
  "schemaVersion": 2,
  "repository": "arcnexus",
  "role": "systems-engineer",
  "executionProfile": "luna",
  "interfaces": [],
  "documentation": [
    "docs/guidance-validation.md"
  ],
  "tests": [
    "tests/runtime/guidance.test.mjs"
  ],
  "relatedIds": [],
  "parentId": "cli-package",
  "operationIds": []
}
