{
  "id": "change-inspection",
  "type": "library",
  "purpose": "Inspect candidate edits and retain complete review evidence",
  "path": "src/changes.ts",
  "objectives": [
    "Detect all staged, unstaged and untracked changes without losing candidate state"
  ],
  "constraints": [
    "Do not change sandbox permissions or verification requirements",
    "Caller owns commits and integration",
    "Do not edit architecture or unrelated files"
  ],
  "allowedWritePaths": [
    "src/changes.ts",
    "tests/runtime/steward.test.mjs",
    "docs/stewards.md"
  ],
  "verification": [
    {
      "command": "npm",
      "args": [
        "run",
        "check"
      ]
    },
    {
      "command": "npm",
      "args": [
        "test"
      ]
    },
    {
      "command": "node",
      "args": [
        "dist/cli.js",
        "guidance",
        "validate",
        "--project",
        "."
      ]
    }
  ],
  "patterns": [
    "Document intent, test observable behavior, implement",
    "Verify actual SDK executable arguments and report settings"
  ],
  "access": {
    "readPaths": [
      "."
    ],
    "writeDirectories": [
      "src",
      "tests",
      "docs",
      "dist"
    ]
  },
  "schemaVersion": 2,
  "repository": "arcnexus",
  "role": "systems-engineer",
  "executionProfile": "luna",
  "interfaces": [
    "changes/checkScope: observed Git evidence"
  ],
  "documentation": [
    "docs/stewards.md"
  ],
  "tests": [
    "tests/runtime/steward.test.mjs"
  ],
  "relatedIds": [],
  "questions": [],
  "parentId": "cli-package",
  "operationIds": []
}
