{
  "id": "assignment",
  "type": "library",
  "purpose": "Coordinate bounded assignments and host verification",
  "path": "src/steward.ts",
  "objectives": [
    "Make actual execution outcomes easy to inspect"
  ],
  "constraints": [
    "Preserve captured authority and evidence"
  ],
  "allowedWritePaths": [
    "src/steward.ts",
    "src/attempts.ts",
    "docs/corrective-attempts.md",
    "docs/execution-contract.md",
    "tests/runtime/steward.test.mjs",
    "tests/runtime/attempts.test.mjs",
    "src/checkpoints.ts",
    "tests/runtime/workflow.test.mjs",
    "tests/runtime/workflow-fixture.mjs",
    "docs/steward-workflow.md",
    "tests/runtime/context.test.mjs",
    "src/plan.ts",
    "tests/runtime/planning.test.mjs",
    "docs/steward-operations.md",
    "tests/runtime/prior-evidence.test.mjs"
  ],
  "verification": [
    {
      "command": "npm",
      "args": [
        "run",
        "check"
      ]
    },
    {
      "command": "npm",
      "args": [
        "test"
      ]
    },
    {
      "command": ".venv/bin/python",
      "args": [
        "-m",
        "unittest",
        "discover",
        "-s",
        "tests/ci",
        "-v"
      ]
    },
    {
      "command": ".venv/bin/python",
      "args": [
        "scripts/check_repository.py"
      ]
    }
  ],
  "questions": [],
  "patterns": [
    "Evidence-backed completion",
    "Small functions with coherent responsibilities",
    "Context acceptance is shared with assignment/steward ownership; caller reviews changes"
  ],
  "access": {
    "readPaths": [
      "."
    ],
    "writeDirectories": [
      "src",
      "schemas",
      "docs",
      "tests",
      "dist"
    ]
  },
  "schemaVersion": 2,
  "repository": "arcnexus",
  "role": "systems-engineer",
  "executionProfile": "luna",
  "interfaces": [
    "runSteward: bounded execution and host verification"
  ],
  "documentation": [
    "docs/corrective-attempts.md",
    "docs/execution-contract.md",
    "docs/steward-workflow.md"
  ],
  "tests": [
    "tests/runtime/steward.test.mjs",
    "tests/runtime/attempts.test.mjs",
    "tests/runtime/workflow.test.mjs",
    "tests/runtime/workflow-fixture.mjs",
    "tests/runtime/context.test.mjs",
    "tests/runtime/prior-evidence.test.mjs"
  ],
  "relatedIds": [
    "steward",
    "workspace",
    "change-inspection",
    "report"
  ],
  "parentId": "cli-package",
  "operationIds": []
}
